[
  {
    "setId": "base-96",
    "purpose": "base",
    "mode": "strips",
    "stopSelection": "uniform_strip",
    "rtpProfileId": "rtp-96",
    "strips": [
      [
        "L2",
        "L1",
        "L4",
        "L2",
        "H2",
        "L1",
        "L4",
        "L5",
        "H3",
        "L2",
        "H4",
        "H1",
        "L5",
        "L1",
        "L3",
        "L4",
        "L3",
        "L5",
        "H2",
        "L5",
        "H4",
        "L2",
        "H1",
        "L5",
        "H3",
        "H2",
        "L4",
        "H4",
        "L3",
        "L2",
        "L3",
        "SCATTER",
        "L4",
        "H4",
        "L1",
        "L4",
        "L3",
        "H3",
        "L5",
        "L1",
        "L3",
        "L2",
        "L1"
      ],
      [
        "L1",
        "L2",
        "L1",
        "L3",
        "H3",
        "L1",
        "H2",
        "L3",
        "L5",
        "H2",
        "L1",
        "L4",
        "L2",
        "L5",
        "H4",
        "H2",
        "L4",
        "L1",
        "L3",
        "L5",
        "L2",
        "H4",
        "L3",
        "L2",
        "L5",
        "L3",
        "SCATTER",
        "WILD",
        "H4",
        "L4",
        "H4",
        "H3",
        "L4",
        "L3",
        "H1",
        "L1",
        "L5",
        "L2",
        "H1",
        "L4",
        "L2",
        "H3",
        "L4"
      ],
      [
        "L2",
        "H1",
        "L5",
        "L1",
        "H2",
        "L3",
        "L4",
        "L3",
        "L2",
        "H4",
        "L2",
        "L1",
        "L5",
        "L1",
        "H3",
        "L2",
        "H1",
        "L4",
        "L5",
        "H4",
        "L4",
        "L5",
        "L1",
        "H4",
        "L4",
        "L2",
        "L5",
        "L3",
        "WILD",
        "H1",
        "L3",
        "H3",
        "L1",
        "H4",
        "L4",
        "L1",
        "H3",
        "H2",
        "L3",
        "L2",
        "H2",
        "SCATTER",
        "L3"
      ],
      [
        "L5",
        "L1",
        "H1",
        "L2",
        "L1",
        "WILD",
        "H2",
        "H3",
        "SCATTER",
        "H2",
        "L5",
        "H4",
        "L3",
        "L1",
        "L3",
        "L2",
        "L4",
        "L1",
        "L4",
        "L3",
        "L1",
        "H4",
        "H3",
        "L5",
        "L4",
        "L5",
        "L4",
        "H1",
        "L2",
        "L3",
        "L4",
        "L5",
        "L1",
        "L2",
        "H4",
        "L2",
        "L4",
        "L3",
        "H3",
        "L3",
        "L2",
        "H2",
        "H4"
      ],
      [
        "L5",
        "L2",
        "L4",
        "L1",
        "L3",
        "L4",
        "L5",
        "L3",
        "H4",
        "L4",
        "H2",
        "L3",
        "H3",
        "L5",
        "L3",
        "L4",
        "L1",
        "L3",
        "L5",
        "H4",
        "L1",
        "H2",
        "L3",
        "L5",
        "SCATTER",
        "L2",
        "L4",
        "L2",
        "L1",
        "H4",
        "H3",
        "L2",
        "L1",
        "L2",
        "L4",
        "H2",
        "L2",
        "H4",
        "L1",
        "H1",
        "H3",
        "L5",
        "H1"
      ]
    ]
  },
  {
    "setId": "feature-strips",
    "purpose": "feature",
    "mode": "strips",
    "stopSelection": "uniform_strip",
    "rtpProfileId": "rtp-96",
    "strips": [
      [
        "WILD",
        "L5",
        "H2",
        "H3",
        "H4",
        "H1",
        "SCATTER",
        "H3",
        "L4",
        "H1",
        "L5",
        "L3",
        "H2",
        "L4",
        "H2",
        "L4",
        "L5",
        "L1",
        "H4",
        "L2",
        "L1",
        "L2",
        "H1",
        "L2",
        "L5",
        "H2",
        "L2",
        "L1",
        "L4",
        "L1",
        "H3",
        "L3",
        "L2",
        "L3",
        "H3",
        "H4",
        "L3",
        "L5",
        "L1",
        "L3",
        "L4",
        "H4"
      ],
      [
        "WILD",
        "L5",
        "SCATTER",
        "L2",
        "L1",
        "H2",
        "L3",
        "L2",
        "H3",
        "L4",
        "L5",
        "H2",
        "L5",
        "H2",
        "H3",
        "H4",
        "L4",
        "H1",
        "L3",
        "L1",
        "H4",
        "L4",
        "L5",
        "H4",
        "L2",
        "H1",
        "L2",
        "L4",
        "L3",
        "H3",
        "L1",
        "L3",
        "L1",
        "L2",
        "L5",
        "WILD",
        "H3",
        "L1",
        "H4",
        "H1",
        "L4",
        "L3",
        "H2"
      ],
      [
        "L3",
        "L2",
        "L1",
        "L2",
        "L4",
        "L5",
        "H4",
        "L4",
        "L5",
        "H3",
        "L2",
        "H4",
        "H2",
        "L1",
        "L4",
        "H1",
        "L3",
        "WILD",
        "H3",
        "L2",
        "H2",
        "H3",
        "H1",
        "L5",
        "SCATTER",
        "H3",
        "H4",
        "L3",
        "L1",
        "L3",
        "WILD",
        "H1",
        "L4",
        "L3",
        "L5",
        "H2",
        "L4",
        "L1",
        "H2",
        "L5",
        "H4",
        "L2",
        "L1"
      ],
      [
        "L1",
        "L5",
        "H1",
        "L5",
        "H3",
        "L1",
        "WILD",
        "L4",
        "L2",
        "H1",
        "L1",
        "H2",
        "L3",
        "L4",
        "L1",
        "H4",
        "L5",
        "L3",
        "H2",
        "H4",
        "L4",
        "L1",
        "L3",
        "WILD",
        "H2",
        "L3",
        "L2",
        "H2",
        "H3",
        "L5",
        "L2",
        "H3",
        "L5",
        "SCATTER",
        "H4",
        "L4",
        "L2",
        "L3",
        "H3",
        "H1",
        "L4",
        "L2",
        "H4"
      ],
      [
        "H1",
        "L3",
        "L5",
        "H2",
        "H3",
        "L5",
        "L4",
        "L3",
        "L5",
        "L1",
        "H3",
        "L1",
        "L4",
        "H3",
        "H1",
        "L2",
        "H3",
        "L4",
        "H2",
        "L3",
        "H2",
        "L2",
        "L5",
        "H2",
        "L4",
        "H4",
        "WILD",
        "L3",
        "L2",
        "L1",
        "L2",
        "H4",
        "L4",
        "H1",
        "SCATTER",
        "H4",
        "L5",
        "L2",
        "L3",
        "L1",
        "H4",
        "L1"
      ]
    ]
  },
  {
    "setId": "super-feature-strips",
    "purpose": "super_feature",
    "mode": "strips",
    "stopSelection": "uniform_strip",
    "rtpProfileId": "rtp-96",
    "strips": [
      [
        "H4",
        "WILD",
        "H2",
        "L1",
        "L5",
        "H3",
        "L1",
        "H3",
        "L5",
        "H4",
        "H2",
        "L5",
        "L2",
        "L4",
        "WILD",
        "L3",
        "L2",
        "L1",
        "H3",
        "H2",
        "L4",
        "L5",
        "H1",
        "SCATTER",
        "L4",
        "L3",
        "H1",
        "H2",
        "H3",
        "L2",
        "H4",
        "H1",
        "L2",
        "H4",
        "H1",
        "H2",
        "L3",
        "L4",
        "H3",
        "L3",
        "L1"
      ],
      [
        "L1",
        "H3",
        "H4",
        "L3",
        "L4",
        "H2",
        "L5",
        "L3",
        "H1",
        "WILD",
        "L5",
        "WILD",
        "L2",
        "H2",
        "L1",
        "L2",
        "L5",
        "H3",
        "L3",
        "L4",
        "H2",
        "L4",
        "L2",
        "H4",
        "H3",
        "L3",
        "WILD",
        "L1",
        "L4",
        "H1",
        "SCATTER",
        "L1",
        "H2",
        "H3",
        "L2",
        "H3",
        "L5",
        "H4",
        "H1",
        "H4",
        "H1",
        "H2"
      ],
      [
        "H4",
        "WILD",
        "SCATTER",
        "L2",
        "H4",
        "L3",
        "L4",
        "H3",
        "L1",
        "L2",
        "H4",
        "L4",
        "H4",
        "H3",
        "H2",
        "L4",
        "H2",
        "L2",
        "L5",
        "H2",
        "L5",
        "WILD",
        "L1",
        "L4",
        "H3",
        "L5",
        "H1",
        "L3",
        "H3",
        "L3",
        "H1",
        "L3",
        "L1",
        "H1",
        "H2",
        "H1",
        "L2",
        "L1",
        "L5",
        "WILD",
        "H3",
        "H2"
      ],
      [
        "H3",
        "L3",
        "L2",
        "L3",
        "L5",
        "H3",
        "H2",
        "L1",
        "SCATTER",
        "H3",
        "H1",
        "WILD",
        "H3",
        "L5",
        "H1",
        "L1",
        "L4",
        "WILD",
        "H4",
        "H2",
        "L3",
        "L1",
        "L3",
        "L1",
        "L4",
        "H4",
        "H2",
        "L2",
        "H2",
        "WILD",
        "L2",
        "H2",
        "H4",
        "L4",
        "H3",
        "L4",
        "L2",
        "L5",
        "H1",
        "H4",
        "H1",
        "L5"
      ],
      [
        "L2",
        "H1",
        "L2",
        "H2",
        "L5",
        "L4",
        "L3",
        "H1",
        "L2",
        "L1",
        "L4",
        "L3",
        "H2",
        "L5",
        "H1",
        "WILD",
        "H4",
        "L2",
        "H3",
        "L3",
        "L5",
        "H3",
        "H2",
        "H3",
        "L1",
        "L4",
        "H2",
        "H3",
        "H2",
        "WILD",
        "L3",
        "H4",
        "L1",
        "H3",
        "L4",
        "H4",
        "SCATTER",
        "H1",
        "H4",
        "L5",
        "L1"
      ]
    ]
  },
  {
    "setId": "ultimate-feature-strips",
    "purpose": "ultimate_feature",
    "mode": "strips",
    "stopSelection": "uniform_strip",
    "rtpProfileId": "rtp-96",
    "strips": [
      [